{
  "id": "wcag-1.3.3-sensory-characteristics",
  "sc": "1.3.3",
  "title": "Sensory Characteristics",
  "level": "A",
  "wcag_versions": [
    "2.0",
    "2.1",
    "2.2"
  ],
  "applies_to": [],
  "check": {
    "type": "manual",
    "description": "Instructions for understanding and operating content never rely on shape, colour, size, visual location, orientation or sound alone — a control referred to by position or colour is also named."
  },
  "severity": "serious",
  "sources": {
    "wcag_url": "https://www.w3.org/WAI/WCAG22/Understanding/sensory-characteristics.html",
    "en301549_clause": "9.1.3.3",
    "internal_policy_ref": "HSBC digital accessibility framework — WCAG 2.2 AA minimum, governed by Group Digital Experience and Accessibility (mandatory on all HSBC digital projects)."
  },
  "external_automatable_refs": []
}
