{
  "id": "wcag-3.3.7-redundant-entry",
  "sc": "3.3.7",
  "title": "Redundant Entry",
  "level": "A",
  "wcag_versions": [
    "2.2"
  ],
  "applies_to": [],
  "check": {
    "type": "manual",
    "description": "Information already entered by or provided to the user in the same process is auto-populated or available to select, unless re-entry is essential, is required for security, or the earlier value is no longer valid."
  },
  "severity": "minor",
  "sources": {
    "wcag_url": "https://www.w3.org/WAI/WCAG22/Understanding/redundant-entry.html",
    "en301549_clause": "9.3.3.7 (pending EN 301 549 alignment to WCAG 2.2)",
    "internal_policy_ref": "HSBC digital accessibility framework — WCAG 2.2 AA minimum, governed by Group Digital Experience and Accessibility (mandatory on all HSBC digital projects)."
  },
  "external_automatable_refs": []
}
