{
  "id": "wcag-1.4.2-audio-control",
  "sc": "1.4.2",
  "title": "Audio Control",
  "level": "A",
  "wcag_versions": [
    "2.0",
    "2.1",
    "2.2"
  ],
  "applies_to": [],
  "check": {
    "type": "semi-automated",
    "description": "Any audio that plays automatically for more than 3 seconds can be paused or stopped, or has a volume control independent of system volume. Conformance Requirement 5 (non-interference) makes this apply to ALL content on the page."
  },
  "severity": "serious",
  "sources": {
    "wcag_url": "https://www.w3.org/WAI/WCAG22/Understanding/audio-control.html",
    "en301549_clause": "9.1.4.2",
    "internal_policy_ref": "HSBC digital accessibility framework — WCAG 2.2 AA minimum, governed by Group Digital Experience and Accessibility (mandatory on all HSBC digital projects)."
  },
  "external_automatable_refs": []
}
