{
  "id": "wcag-3.2.4-consistent-identification",
  "sc": "3.2.4",
  "title": "Consistent Identification",
  "level": "AA",
  "wcag_versions": [
    "2.0",
    "2.1",
    "2.2"
  ],
  "applies_to": [],
  "check": {
    "type": "manual",
    "description": "Components with the same functionality across a set of pages are identified consistently — the same accessible name and the same text alternative for the same icon."
  },
  "severity": "serious",
  "sources": {
    "wcag_url": "https://www.w3.org/WAI/WCAG22/Understanding/consistent-identification.html",
    "en301549_clause": "9.3.2.4",
    "internal_policy_ref": "HSBC digital accessibility framework — WCAG 2.2 AA minimum, governed by Group Digital Experience and Accessibility (mandatory on all HSBC digital projects)."
  },
  "external_automatable_refs": []
}
