{
  "id": "wcag-2.5.2-pointer-cancellation",
  "sc": "2.5.2",
  "title": "Pointer Cancellation",
  "level": "A",
  "wcag_versions": [
    "2.1",
    "2.2"
  ],
  "applies_to": [],
  "check": {
    "type": "manual",
    "description": "Single-pointer functionality completes on the up-event, or provides abort/undo, or the up-event reverses the down-event — unless down-event completion is essential (keyboard emulation)."
  },
  "severity": "serious",
  "sources": {
    "wcag_url": "https://www.w3.org/WAI/WCAG22/Understanding/pointer-cancellation.html",
    "en301549_clause": "9.2.5.2",
    "internal_policy_ref": "HSBC digital accessibility framework — WCAG 2.2 AA minimum, governed by Group Digital Experience and Accessibility (mandatory on all HSBC digital projects)."
  },
  "external_automatable_refs": []
}
