{
  "id": "wcag-1.4.12-text-spacing",
  "sc": "1.4.12",
  "title": "Text Spacing",
  "level": "AA",
  "wcag_versions": [
    "2.1",
    "2.2"
  ],
  "applies_to": [
    "Grid / stack utilities"
  ],
  "check": {
    "type": "semi-automated",
    "description": "No loss of content or functionality when the user overrides text spacing: line height 1.5x font size, paragraph spacing 2x, letter spacing 0.12x, word spacing 0.16x."
  },
  "severity": "serious",
  "sources": {
    "wcag_url": "https://www.w3.org/WAI/WCAG22/Understanding/text-spacing.html",
    "en301549_clause": "9.1.4.12",
    "internal_policy_ref": "HSBC digital accessibility framework — WCAG 2.2 AA minimum, governed by Group Digital Experience and Accessibility (mandatory on all HSBC digital projects)."
  },
  "external_automatable_refs": [
    {
      "source": "axe-core",
      "source_version": "4.12.1",
      "rule_id": "avoid-inline-spacing",
      "description": "Ensure that text spacing set through style attributes can be adjusted with custom stylesheets",
      "url": "https://dequeuniversity.com/rules/axe/4.12/avoid-inline-spacing?application=axeAPI"
    }
  ]
}