{
  "id": "wcag-1.4.3-contrast-minimum",
  "sc": "1.4.3",
  "title": "Contrast (Minimum)",
  "level": "AA",
  "wcag_versions": [
    "2.0",
    "2.1",
    "2.2"
  ],
  "applies_to": [
    "Accordion",
    "Account card",
    "Action bar",
    "Alert",
    "Amount display",
    "Amount input",
    "App shell — multi-column",
    "App shell — side nav",
    "App shell — top / stacked nav",
    "Avatar group",
    "Banner",
    "Button",
    "Calendar",
    "Cards",
    "Confirmation",
    "Date picker",
    "Date-range picker",
    "Document row",
    "Eyebrow",
    "File upload",
    "Footer",
    "Footer-doormat-lockup",
    "Form layout",
    "Hero",
    "KPI tile",
    "Links",
    "List items",
    "Modals",
    "Notifications",
    "Popconfirm",
    "Secure entry",
    "Status indicator",
    "Stepper",
    "Summary",
    "Tab-bar",
    "Tags",
    "Textarea",
    "Time picker",
    "Timeline",
    "Tooltip",
    "Tree",
    "Video player"
  ],
  "check": {
    "type": "automated",
    "description": "Text and images of text meet a contrast ratio of at least 4.5:1 (3:1 for large text >=18pt or >=14pt bold).",
    "threshold": "4.5:1 normal / 3:1 large"
  },
  "severity": "serious",
  "sources": {
    "wcag_url": "https://www.w3.org/WAI/WCAG22/Understanding/contrast-minimum.html",
    "en301549_clause": "9.1.4.3",
    "internal_policy_ref": "HSBC digital accessibility framework — WCAG 2.2 AA minimum, governed by Group Digital Experience and Accessibility (mandatory on all HSBC digital projects). GTB brand: grey-6 (#767676) is the minimum text colour on white (~4.48:1)."
  },
  "verified_by": {
    "script": "_build_surface_contrast_audit.py + tokens/_build_blast_radius.py",
    "artifact": "_TEXT-CONTRAST-AUDIT.json",
    "mechanism": "Every text/icon token in the store is contrast-checked at 4.5:1 against its worst-case dark surface (gates the build); joined down to component granularity via the token blast-radius reverse index.",
    "granularity": "component",
    "result": "pass",
    "checked": "2026-09-07",
    "per_component": {
      "Accordion": "pass",
      "Account card": "pass",
      "Action bar": "pass",
      "Alert": "pass",
      "Amount display": "pass",
      "Amount input": "pass",
      "App shell — multi-column": "pass",
      "App shell — side nav": "pass",
      "App shell — top / stacked nav": "pass",
      "Avatar group": "pass",
      "Banner": "pass",
      "Button": "pass",
      "Calendar": "pass",
      "Cards": "pass",
      "Confirmation": "pass",
      "Date picker": "pass",
      "Date-range picker": "pass",
      "Document row": "pass",
      "Eyebrow": "pass",
      "File upload": "pass",
      "Footer": "pass",
      "Footer-doormat-lockup": "not_covered",
      "Form layout": "pass",
      "Hero": "pass",
      "KPI tile": "pass",
      "Links": "pass",
      "List items": "pass",
      "Modals": "pass",
      "Notifications": "pass",
      "Popconfirm": "pass",
      "Secure entry": "pass",
      "Status indicator": "pass",
      "Stepper": "pass",
      "Summary": "pass",
      "Tab-bar": "pass",
      "Tags": "pass",
      "Textarea": "pass",
      "Time picker": "pass",
      "Timeline": "pass",
      "Tooltip": "pass",
      "Tree": "pass",
      "Video player": "pass"
    },
    "coverage": "41/42 applies_to components have a bound audited token"
  },
  "external_automatable_refs": [
    {
      "source": "axe-core",
      "source_version": "4.12.1",
      "rule_id": "color-contrast",
      "description": "Ensure the contrast between foreground and background colors meets WCAG 2 AA minimum contrast ratio thresholds",
      "url": "https://dequeuniversity.com/rules/axe/4.12/color-contrast?application=axeAPI"
    }
  ]
}